9,Science,What is the name for a substance that speeds up a chemical reaction?,Catalyst,Remains unchanged at the end of the reaction
9,Science,What part of the cell contains the genetic material?,Nucleus,Control center of the cell
9,Science,What is the formula for calculating speed?,Distance divided by time,Speed = distance/time
9,Science,What is the process by which liquid water changes into water vapor?,Evaporation,Occurs at the surface of liquids
9,Science,What is the main function of the respiratory system?,To provide oxygen to the body and remove carbon dioxide,Involves breathing in and out
9,English,What is a metaphor?,A figure of speech that makes a comparison between two unlike things without using like or as,Helps create vivid imagery
9,English,What is the protagonist in a story?,The main character,The central figure the story revolves around
9,English,What is a synonym?,A word that means the same or nearly the same as another word,Useful for avoiding repetition in writing
9,English,What is the past tense of the verb 'to swim'?,Swam,Irregular verb form
9,English,What is an adjective?,A word that describes or modifies a noun,Adds detail to descriptions
9,English,What is alliteration?,The repetition of the same sound at the beginning of closely connected words,Creates rhythm and emphasis
9,English,What is a simile?,A figure of speech comparing two unlike things using 'like' or 'as',Helps create clear images
9,English,What is the plural form of 'child'?,Children,Irregular plural noun
9,English,What is a verb?,A word that describes an action; state; or occurrence,The main part of the predicate of a sentence
9,English,What is the main purpose of a thesis statement?,To state the main idea of an essay or paper,Usually appears in the introduction
9,English,What is a noun?,A word that names a person; place; thing; or idea,Can be proper or common
9,English,What is personification?,Giving human qualities to non-human things,Brings non-human elements to life
9,English,What is an adverb?,A word that modifies a verb; adjective; or another adverb,Often ends in '-ly'
9,English,What is the subject of a sentence?,The person or thing that performs the action or is being described,Usually comes before the verb
9,English,What is onomatopoeia?,Words that imitate the sound they describe,Examples include buzz; splash; and pop
9,English,What is a preposition?,A word that shows the relationship between a noun and other words in a sentence,Examples include in; on; under; and beside
9,English,What is a homonym?,Words that sound the same but have different meanings,Examples include their/there/they're
9,English,What is the main difference between a biography and an autobiography?,A biography is written by someone else; an autobiography is written by the subject themselves,Both are accounts of a person's life
9,English,What is foreshadowing?,A literary device where the author gives hints about what will happen later in the story,Creates anticipation and tension
9,History,When did World War I begin?,1914,Triggered by the assassination of Archduke Franz Ferdinand
9,History,Who was the first European explorer to reach Australia?,Willem Janszoon,Dutch navigator who landed in 1606
9,History,What was the name of the policy that removed Aboriginal children from their families?,The Stolen Generations,Government policy from early 1900s to 1970s
9,History,When did Federation occur in Australia?,1901,Six colonies became one nation
9,History,Who was the first Prime Minister of Australia?,Edmund Barton,Served from 1901 to 1903
9,History,What treaty ended World War I?,Treaty of Versailles,Signed in 1919
9,History,Who led the Russian Revolution in 1917?,Vladimir Lenin,Founded the Soviet Union
9,History,What was the Renaissance?,A period of cultural rebirth and renewed interest in classical learning,Began in Italy in the 14th century
9,History,Who was Captain James Cook?,British explorer who charted the east coast of Australia,Arrived at Botany Bay in 1770
9,History,What was the Cold War?,A period of geopolitical tension between the United States and the Soviet Union,Lasted from 1947 to 1991
9,History,What was the Industrial Revolution?,A period of transition to new manufacturing processes,Began in Britain in the late 18th century
9,History,Who were the ANZACs?,Australian and New Zealand Army Corps who fought in World War I,Remembered for their role in the Gallipoli Campaign
9,History,What was the Great Depression?,A severe worldwide economic depression in the 1930s,Began with the U.S. stock market crash of 1929
9,History,Who was the first woman to become a member of Australian Parliament?,Edith Cowan,Elected to Western Australian Legislative Assembly in 1921
9,History,What is the significance of the Eureka Stockade?,A rebellion of gold miners against colonial authority,Occurred in Ballarat in 1854
9,History,When did Captain Arthur Phillip arrive with the First Fleet?,1788,Established the first European settlement in Australia
9,History,What was the White Australia Policy?,Immigration restriction policies favoring European immigrants,Officially abolished in 1973
9,History,Who was Ned Kelly?,An Australian bushranger and outlaw,Known for his homemade suit of armor
9,History,What year did women gain the right to vote in Federal elections in Australia?,1902,Australia was among the first countries to grant women this right
9,Geography,What is the capital city of Australia?,Canberra,Planned city designed by Walter Burley Griffin
9,Geography,Which is the largest ocean on Earth?,Pacific Ocean,Covers more than 30% of Earth's surface
9,Geography,What is the name of the largest desert in Australia?,Great Victoria Desert,Spans Western Australia and South Australia
9,Geography,What is a peninsula?,A piece of land almost surrounded by water,Connected to the mainland on one side
9,Geography,What are the three main types of rock?,Igneous; sedimentary; and metamorphic,Classified based on how they form
9,Geography,What is the capital of Japan?,Tokyo,Located on the island of Honshu
9,Geography,What is erosion?,The process of wearing away soil and rock by water; wind; or ice,Changes the landscape over time
9,Geography,What is the largest coral reef system in the world?,Great Barrier Reef,Located off the coast of Queensland
9,Geography,What causes tsunamis?,Underwater earthquakes; volcanic eruptions; or landslides,Creates powerful ocean waves
9,Geography,What is the driest inhabited continent?,Australia,Much of the continent is desert or semi-arid
9,Geography,What is the name of the line that divides the Earth into Northern and Southern Hemispheres?,Equator,0 degrees latitude
9,Geography,What is the capital of New South Wales?,Sydney,Australia's largest city
9,Geography,What is the difference between weather and climate?,Weather is short-term conditions; climate is the average weather pattern over a long period,Climate describes what's expected; weather describes what happens
9,Geography,Which mountain range runs along Australia's east coast?,Great Dividing Range,Extends from Queensland to Victoria
9,Geography,What is the primary cause of the greenhouse effect?,Gases in the atmosphere trapping heat,Carbon dioxide is a major greenhouse gas
9,Geography,What is a topographic map?,A map showing physical features of the land,Uses contour lines to show elevation
9,Geography,What is the name of the sea between Australia and New Zealand?,Tasman Sea,Named after Dutch explorer Abel Tasman
9,Geography,What are the three main layers of the Earth?,Crust; mantle; and core,The core has inner and outer parts
9,Geography,What is the longest river in Australia?,Murray River,Flows through New South Wales; Victoria; and South Australia